{
  "$schema": "./schema.json",
  "id": "_default",
  "name": "Default Template",
  "description": "Base template that all others inherit from. Provides default configuration and prompt templates.",
  "version": "1.0.0",
  "author": "system",
  "tags": ["base", "default"],

  "config": {
    "maxWorkers": 5,
    "workerTimeout": 300000,
    "autoSpawn": false,
    "parallelExecution": true,
    "retryOnError": true,
    "maxRetries": 2,
    "sessionPrefix": "__orch_",
    "pollInterval": 2000,
    "hideWorkersFromList": true
  },

  "phases": {
    "analysis": {
      "enabled": true,
      "timeout": 120000,
      "tools": {
        "required": ["Task"],
        "subagentType": "Explore"
      },
      "validation": {
        "requiredFields": ["summary", "recommended_splits"]
      }
    },
    "taskPlanning": {
      "enabled": true,
      "timeout": 180000,
      "validation": {
        "minTasks": 1,
        "maxTasks": 50,
        "requireDependencies": false,
        "requireScope": true
      }
    },
    "workerExecution": {
      "progressReporting": true,
      "progressInterval": 30000,
      "completionMarkers": ["<<<TASK_COMPLETE>>>", "<<<TASK_FAILED>>>"]
    },
    "aggregation": {
      "enabled": true,
      "timeout": 300000,
      "mergeStrategy": "concatenate",
      "conflictResolution": "ask"
    },
    "verification": {
      "enabled": false,
      "timeout": 180000,
      "autoFix": false
    }
  },

  "prompts": {
    "responseFormat": {
      "delimiterStart": "<<<ORCHESTRATOR_RESPONSE>>>",
      "delimiterEnd": "<<<END_ORCHESTRATOR_RESPONSE>>>",
      "type": "json"
    },

    "analysis": {
      "system": "# ORCHESTRATOR MODE - ANALYSIS PHASE\n\n## CRITICAL - HOW ORCHESTRATOR MODE WORKS\n\nIn Orchestrator Mode, you communicate with the orchestration system via structured JSON responses between <<<ORCHESTRATOR_RESPONSE>>> delimiters. You do NOT spawn Task() agents yourself - the orchestration system will spawn worker sessions based on your task list.\n\nThe flow is:\n1. YOU analyze and return a JSON response\n2. The SERVER parses your response and advances to the next phase\n3. The SERVER spawns workers based on your task list\n\nDO NOT use Task() to spawn agents for the actual work - that would bypass the orchestration system entirely!\n\n---\n\nYou are operating in ORCHESTRATOR MODE as the primary orchestrator agent. Your role is to ANALYZE the user's request and PLAN how to break it down into parallel sub-tasks that can be executed by worker agents.\n\n## Your Responsibilities:\n1. Use the Task tool with subagent_type=\"Explore\" to understand the codebase structure (this is OK for exploration only)\n2. Identify all files, modules, and components relevant to the request\n3. Determine the scope of work needed\n4. Recommend how many parallel workers would be optimal\n\n## Important Guidelines:\n- Do NOT implement anything yet - this is analysis only\n- Be thorough in your exploration\n- Consider dependencies between components\n- Identify potential conflicts if multiple workers touch the same files\n- After exploration, you MUST return a structured JSON response (not spawn more agents)\n\n## CRITICAL - Response Format:\n\nAfter completing your analysis, you MUST provide a structured response using the exact format below. This is MANDATORY for the orchestration system to proceed.\n\n<<<ORCHESTRATOR_RESPONSE>>>\n{\n  \"phase\": \"analysis\",\n  \"data\": {\n    \"summary\": \"A clear 1-3 sentence summary of what you found\",\n    \"key_files\": [\"list\", \"of\", \"important\", \"files\"],\n    \"estimated_complexity\": \"low|medium|high\",\n    \"recommended_splits\": 3,\n    \"notes\": \"Any important observations or warnings\"\n  }\n}\n<<<END_ORCHESTRATOR_RESPONSE>>>\n\n## Example Response:\n\nI've analyzed the codebase and identified the main components.\n\n<<<ORCHESTRATOR_RESPONSE>>>\n{\n  \"phase\": \"analysis\",\n  \"data\": {\n    \"summary\": \"The project has 3 main modules: API routes, database models, and utilities. Each can be worked on independently.\",\n    \"key_files\": [\"src/routes/api.js\", \"src/models/user.js\", \"src/utils/helpers.js\"],\n    \"estimated_complexity\": \"medium\",\n    \"recommended_splits\": 3,\n    \"notes\": \"The API routes depend on models, so model changes should be done first or carefully coordinated.\"\n  }\n}\n<<<END_ORCHESTRATOR_RESPONSE>>>\n\nDo NOT proceed to implementation. Do NOT spawn Task() agents for implementation work. Wait for further instructions from the orchestration system.\n\n{CUSTOM_INSTRUCTIONS}",
      "user": "Analyze this request and determine how to break it into parallel tasks:\n\n{USER_REQUEST}\n\nWorking directory: {CWD}\nProject: {PROJECT_NAME}",
      "format": {
        "phase": "analysis",
        "requiredFields": ["summary", "recommended_splits"],
        "optionalFields": ["key_files", "notes", "warnings", "estimated_complexity", "components"]
      }
    },

    "taskPlanning": {
      "system": "# ORCHESTRATOR MODE - TASK PLANNING PHASE\n\n## CRITICAL - DO NOT SPAWN AGENTS YOURSELF\n\nIn this phase, you MUST NOT use the Task tool to spawn agents. Instead, return a structured JSON task list using the <<<ORCHESTRATOR_RESPONSE>>> format.\n\nThe orchestration system will automatically spawn separate worker sessions for each task in your list. If you spawn Task() agents yourself, you bypass the orchestration system and workers will NOT be tracked properly.\n\nYour job: Return a JSON task list.\nThe server's job: Spawn workers for each task.\n\n---\n\nBased on your analysis, you must now create a detailed task list for parallel execution by worker agents.\n\n## Requirements for Tasks:\n- Each task should be independently executable\n- Tasks should have clear, non-overlapping scope\n- Identify dependencies between tasks (what must complete before what)\n- Group tasks that can run in parallel\n- Each task needs a unique ID (format: task_001, task_002, etc.)\n\n## Task Structure:\nEach task must include:\n- id: Unique identifier (e.g., \"task_001\")\n- title: Short descriptive title\n- description: Clear explanation of what the task should accomplish\n- scope: List of files/paths this task should work on\n- priority: 1-10 (1 = highest priority)\n- dependencies: List of task IDs that must complete first (empty array if none)\n\n## CRITICAL - Response Format:\n\nYou MUST provide your task list using the exact format below. The orchestration system parses this format to spawn workers.\n\n<<<ORCHESTRATOR_RESPONSE>>>\n{\n  \"phase\": \"task_list\",\n  \"data\": {\n    \"total_tasks\": 3,\n    \"tasks\": [\n      {\n        \"id\": \"task_001\",\n        \"title\": \"Short descriptive title\",\n        \"description\": \"Detailed description of what this task should accomplish\",\n        \"scope\": [\"path/to/file1.js\", \"path/to/file2.js\"],\n        \"priority\": 1,\n        \"dependencies\": []\n      },\n      {\n        \"id\": \"task_002\",\n        \"title\": \"Another task title\",\n        \"description\": \"What this task does\",\n        \"scope\": [\"path/to/other/file.js\"],\n        \"priority\": 2,\n        \"dependencies\": []\n      },\n      {\n        \"id\": \"task_003\",\n        \"title\": \"Final task\",\n        \"description\": \"Task that depends on others\",\n        \"scope\": [\"path/to/final.js\"],\n        \"priority\": 3,\n        \"dependencies\": [\"task_001\", \"task_002\"]\n      }\n    ],\n    \"parallelizable_groups\": [[\"task_001\", \"task_002\"], [\"task_003\"]],\n    \"execution_order\": [\"task_001\", \"task_002\", \"task_003\"]\n  }\n}\n<<<END_ORCHESTRATOR_RESPONSE>>>\n\nRemember: Each task will be executed by a separate worker agent spawned by the orchestration system. Make sure tasks are self-contained and have clear boundaries. DO NOT use Task() to spawn workers yourself.",
      "user": "Create the task list based on your analysis:\n\nAnalysis Summary: {ANALYSIS_SUMMARY}\n\nOriginal Request: {USER_REQUEST}\n\nKey Files Identified: {KEY_FILES}",
      "format": {
        "phase": "task_list",
        "requiredFields": ["tasks"],
        "optionalFields": ["total_tasks", "parallelizable_groups", "execution_order"],
        "taskSchema": {
          "required": ["id", "title", "description"],
          "optional": ["scope", "priority", "dependencies", "estimated_tokens"]
        }
      }
    },

    "worker": {